{
  "schema_version": "c4_auto.engineering_contract.v1",
  "document_type": "c4_auto_engineering_contract",
  "contract_id": "C4-AUTO-ENGINEERING-CONTRACT",
  "contract_version": "1.3.0",
  "canonicalization": {"encoding": "UTF-8", "json_sort_keys": true, "json_separators": [",", ":"], "hash_algorithm": "SHA-256"},
  "global_invariants": [
    {"id": "INV-01", "name": "HUMAN_AUTHORITY", "rule": "PASS_CANDIDATE is never Human approval."},
    {"id": "INV-02", "name": "SCOPE_IMMUTABILITY", "rule": "Execution cannot expand the Human-approved path scope."},
    {"id": "INV-03", "name": "ACCEPTANCE_IMMUTABILITY", "rule": "Acceptance criteria cannot be weakened, removed, skipped, or reinterpreted."},
    {"id": "INV-04", "name": "EVIDENCE_IMMUTABILITY", "rule": "Evidence cannot be edited, fabricated, truncated, or backfilled to manufacture success."},
    {"id": "INV-05", "name": "FAIL_CLOSED", "rule": "Missing required evidence produces FAIL or HUMAN_REVIEW_REQUIRED."},
    {"id": "INV-06", "name": "BOUNDED_REMEDIATION", "rule": "Automatic remediation is approval-boundary scoped and limited to two cumulative cycles."},
    {"id": "INV-07", "name": "ROOT_CAUSE_REQUIREMENT", "rule": "Remediation requires machine-enforced bounded classifications and a concrete explanation."},
    {"id": "INV-08", "name": "DETERMINISTIC_VERDICT", "rule": "Verdicts are derived from reconstructed machine-observable authority and cannot be caller-selected."},
    {"id": "INV-09", "name": "TEST_INTEGRITY", "rule": "Failed, skipped, missing, zero, and ambiguous test evidence remains visible and dispositioned."},
    {"id": "INV-10", "name": "REPLAY_FRESH_STATE", "rule": "Replay commands execute in a fresh process and remain bound to persisted evidence."},
    {"id": "INV-11", "name": "AUTHORITATIVE_SAFETY", "rule": "The runner exposes no authoritative or production write operation."},
    {"id": "INV-12", "name": "RIGHTS_SAFETY", "rule": "The runner exposes no rights-gated acquisition operation."},
    {"id": "INV-13", "name": "AUDITABILITY", "rule": "Every run and remediation is linked through the approval-wide ledger."},
    {"id": "INV-14", "name": "STOPPABILITY", "rule": "Every execution path has a deterministic stop condition."},
    {"id": "INV-15", "name": "ROLLBACK_BOUNDARY", "rule": "Every stage declares a reversible rollback boundary."}
  ],
  "global_hard_gates": [
    {"id": "HG-ARCHITECTURE", "name": "ARCHITECTURE_CHANGE"}, {"id": "HG-CANONICAL-CONTRACT", "name": "CANONICAL_OR_AUTHORITATIVE_CONTRACT_CHANGE"},
    {"id": "HG-PRODUCTION-WRITE", "name": "PRODUCTION_WRITE"}, {"id": "HG-AUTHORITATIVE-WRITE", "name": "AUTHORITATIVE_OR_PRIVATE_DB_WRITE"},
    {"id": "HG-DESTRUCTIVE-MIGRATION", "name": "DESTRUCTIVE_MIGRATION"}, {"id": "HG-CANONICAL-PROMOTION", "name": "CANONICAL_DATA_PROMOTION"},
    {"id": "HG-HISTORICAL-PDF", "name": "REAL_HISTORICAL_PDF_ACQUISITION"}, {"id": "HG-RIGHTS", "name": "RIGHTS_BOUNDARY_CHANGE"},
    {"id": "HG-PIT", "name": "PIT_ENABLEMENT"}, {"id": "HG-RESEARCH-DATASET", "name": "RESEARCH_DATASET_ENABLEMENT"},
    {"id": "HG-BACKTEST", "name": "BACKTEST_ENABLEMENT"}, {"id": "HG-PREDICTION", "name": "PREDICTION_ENABLEMENT"},
    {"id": "HG-DEPLOY", "name": "PRODUCTION_DEPLOYMENT"}, {"id": "HG-MERGE-RELEASE", "name": "MERGE_OR_RELEASE"},
    {"id": "HG-ACCEPTANCE", "name": "ACCEPTANCE_CRITERIA_WEAKENING"}, {"id": "HG-RETRY", "name": "RETRY_LIMIT_EXCEEDED"},
    {"id": "HG-ROOT-CAUSE", "name": "UNKNOWN_ROOT_CAUSE"}
  ],
  "approval_boundary_policy": {"identity_inputs": ["stage_id", "contract_sha256", "manifest_sha256", "approved_base_sha", "approval_id"], "approved_digests_are_authority": true, "run_id_is_authority": false, "terminal_state_persists_across_runs": true, "remediation_budget_scope": "APPROVAL_BOUNDARY", "test_baseline_scope": "APPROVAL_BOUNDARY"},
  "remediation_policy": {"max_cycles": 2, "root_cause_required": true, "structured_classification_required": true, "architecture_change_allowed": false, "acceptance_change_allowed": false, "authoritative_semantic_change_allowed": false, "rights_boundary_change_allowed": false},
  "scope_policy": {"detect_committed": true, "detect_staged": true, "detect_unstaged": true, "detect_untracked": true, "ignore_git_ignored_runtime": true, "recheck_between_tiers": true, "candidate_seal_required": true, "seal_authority": "ALLOWED_PATHS", "repository_state_dimensions": ["APPROVED_BASE_HEAD", "GIT_INDEX", "WORKING_TREE", "UNTRACKED_ABSENT"], "index_source": "GIT_LS_FILES_STAGE_Z", "candidate_seal_version": 2, "test_baseline_dual_state": true},
  "test_tier_policy": {"ordered_tiers": ["targeted", "focused", "coupled", "full", "replay_e2e"], "supported_check_kinds": ["TEST", "VALIDATION", "REPLAY"], "full_on_stable_candidate_only": true, "required_tiers_cannot_be_omitted": true, "unexpected_skips_fail": true, "ambiguous_counts_fail": true, "zero_tests_fail": true},
  "evidence_policy": {"machine_primary": true, "markdown_derived_only": true, "approval_ledger_required": true, "event_tail_anchored": true, "basis_values": ["OBSERVED", "DERIVED", "DECLARED", "NOT_VERIFIED"], "declared_satisfies_machine_criteria": false, "not_verified_satisfies_machine_criteria": false, "preserve_conflicts": true, "redact_logs": true},
  "security_policy": {"remote_schema_resolution": false, "shell_execution": false, "serialize_environment": false, "serialize_secrets": false, "serialize_raw_argv": false, "inherit_pythonpath": false, "serialize_private_payloads": false},
  "child_command_trust_model": {"model": "HUMAN_APPROVED_FROZEN_LOCAL_VALIDATION", "side_effect_sandbox_claimed": false, "human_approval_is_trust_root": true},
  "runner_capabilities": {"commit": false, "push": false, "create_pr": false, "merge": false, "deploy": false, "network_acquisition": false, "authoritative_write": false, "private_write": false, "historical_pdf_acquisition": false},
  "rollback_policy": {"development_tooling_only": true, "irreversible_migration_allowed": false, "default_action": "REVERT_TOOLING_AND_RETURN_TO_MANUAL_VALIDATION"},
  "verdicts": ["PASS_CANDIDATE", "FAIL", "HUMAN_REVIEW_REQUIRED"]
}
